RANK,Last Name,First Name,MI,Serial Number,Unit Code,Sub-Unit,Category,CGMC/CGNOC Class,SPECIALIZATION,FUNCTIONAL,BLMC/ALMC/CGNOAC,CGNOSEC,Original Enlistment,Date Entered the Service,CompRet,Last Date of Promotion,CGOC Class,Coast Guard Station Commanders Course Class,Coast Guard Staff Course,Coast Guard Officer Senior Executive Course,Third Level Career Course,Seminar/Workshops,Upload File,Remarks
Chief Petty Officer,Torres,Miguel,A,CG-2020-001,CG-SD,Operations Division,Non-Officer,CGMC Class 2020-01,Operations Specialization,Maritime Safety Administration,BLMC Class 2019-02,CGNOSEC Class 2021-01,2015-03-15,2015-03-15,Active,2023-06-15,,,,,,Maritime Security Workshop 2023; Search and Rescue Training 2022; Environmental Protection Seminar 2021,,Experienced operations specialist with strong leadership skills
Petty Officer 3,Santos,Maria,B,CG-2021-002,CG-SB,Technical Division,Non-Officer,CGNOC Class 2021-03,Machinery Technician,Marine Environment Protection,ALMC Class 2020-01,,2018-07-20,2018-07-20,Active,2022-12-10,,,,,,Engine Maintenance Workshop 2023; Pollution Response Training 2022,,Skilled machinery technician with environmental protection expertise
Commander,Fernandez,Roberto,F,CG-2010-001,CG-HQ,Operations Directorate,General Line Officer,,,,,,,,,CGOC Class 2010-01,CGSCC Class 2018-01,CGSC Class 2015-02,CGEC Class 2022-01,Third Level Career Course 2020,Strategic Leadership Seminar 2023; International Maritime Law Conference 2022; Command and Control Workshop 2021,,Senior officer with extensive command experience and strategic planning expertise
Lieutenant,Rodriguez,Carlos,G,CG-2015-002,CG-DV,District Operations,General Line Officer,,,,,,,,,CGOC Class 2015-03,CGSCC Class 2021-02,CGSC Class 2019-01,,,,District Operations Management 2023; Maritime Law Enforcement Training 2022; Staff Planning Workshop 2021,,Experienced district operations officer with strong management skills
Lieutenant Junior Grade,Villanueva,Patricia,I,CG-2019-004,CG-DM,Technical Operations,Technical Officer,,,,,,,,,CGOC Class 2019-01,,,,,Technical Operations Management 2023; Engineering Systems Workshop 2022; Technical Planning Seminar 2021,,Technical officer with strong engineering background and operational expertise 